[{"certificate_ids":[],"hit_policy":"unique","input_columns":["体温","心拍数","収縮期血圧"],"output_columns":["対応"],"rows":[{"cell_refs":[{"col":0,"row":0,"table_id":"tbl_vitals"},{"col":1,"row":0,"table_id":"tbl_vitals"}],"conditions":[{"field":"temperature","op":">=","unit":"Cel","value":38},{"field":"heart_rate","op":"*"},{"field":"systolic_bp","op":"*"}],"outputs":[{"action":"administer_antipyretic","label_ja":"解熱薬投与を検討"}],"row_id":"row_temp_high","source_span_ids":["span_cell_r0c0","span_cell_r0c1"]},{"cell_refs":[{"col":0,"row":1,"table_id":"tbl_vitals"},{"col":1,"row":1,"table_id":"tbl_vitals"}],"conditions":[{"field":"temperature","op":">=","unit":"Cel","value":38.5},{"field":"heart_rate","op":"*"},{"field":"systolic_bp","op":"*"}],"outputs":[{"action":"initiate_cooling","label_ja":"冷却処置を開始"}],"row_id":"row_temp_very_high","source_span_ids":["span_cell_r1c0","span_cell_r1c1"]},{"cell_refs":[{"col":0,"row":2,"table_id":"tbl_vitals"},{"col":1,"row":2,"table_id":"tbl_vitals"}],"conditions":[{"field":"temperature","op":"*"},{"field":"heart_rate","op":">","unit":"/min","value":90},{"field":"systolic_bp","op":"*"}],"outputs":[{"action":"enhance_monitoring","label_ja":"経過観察を強化"}],"row_id":"row_hr_high","source_span_ids":["span_cell_r2c0","span_cell_r2c1"]},{"cell_refs":[{"col":0,"row":3,"table_id":"tbl_vitals"},{"col":1,"row":3,"table_id":"tbl_vitals"}],"conditions":[{"field":"temperature","op":"*"},{"field":"heart_rate","op":"*"},{"field":"systolic_bp","op":"<","unit":"mm[Hg]","value":90}],"outputs":[{"action":"fluid_resuscitation","label_ja":"輸液負荷を開始"}],"row_id":"row_bp_low","source_span_ids":["span_cell_r3c0","span_cell_r3c1"]}],"source_table_id":"tbl_vitals","table_id":"dt_vitals_triage"}]