{"certificate_ids":[],"hit_policy":"unique","input_columns":["体温 (°C)","心拍数"],"output_columns":["アラート レベル"],"rows":[{"cell_refs":[],"conditions":[{"field":"temp","op":">=","unit":"Cel","value":38}],"outputs":[{"dose":{"unit":"mL","value":500}}],"row_id":"row_z","source_span_ids":[]},{"cell_refs":[],"conditions":[{"field":"temp","unit":"Cel","value":37}],"outputs":[{"action":"normal"}],"row_id":"row_a","source_span_ids":[]}],"table_id":"nf-708cbe1812ee2cc2898301c29432ed9e"}